{
  "symbol": "688322.SH",
  "as_of_date": "2026-06-23",
  "layer": "3D vision sensing module adoption",
  "bottleneck_reason": "Filings show improving revenue, but the robotics and 3D-vision bottleneck claim still needs customer, order, and segment proof.",
  "revenue_transmission": "Revenue transmits through module shipments, robotics/customer adoption, gross-margin recovery, and validated product mix.",
  "serenity_fit": 0.58,
  "evidence_supported_growth": "H2",
  "required_next_evidence": "Verify robotics/customer revenue split, order durability, dilution impact, and cash-flow conversion before upgrading payoff claims.",
  "posterior_basis": "Official report evidence supports H2 evidence-supported growth until L0/L1 business-line proof covers customer, order, and cash-flow conversion.",
  "key_evidence_refs": [
    {
      "claim": "CNINFO announcement artifacts anchor the official disclosure trail used by the research packet.",
      "source_ref": "filings_announcements:CNINFO_Announcements_L0",
      "source_level": "L0",
      "confidence": 0.72
    },
    {
      "claim": "The financial quality matrix shows recovery evidence while cash-flow and valuation evidence remain incomplete for H5 support.",
      "source_ref": "financial quality matrix",
      "source_level": "L3",
      "confidence": 0.62
    }
  ],
  "contrary_evidence": [
    "Operating cash flow, private-placement dilution, and robotics revenue split remain pressure points."
  ],
  "research_questions": [
    "Verify robotics/customer revenue split and order durability.",
    "Quantify private-placement dilution and buyback execution before treating the candidate as action-ready."
  ],
  "ai_confidence": "MEDIUM"
}
